{
  "schemaVersion": 1,
  "package": "axon-slave",
  "version": "0.1.10",
  "publishedAt": "2026-10-14T03:15:06Z",
  "prerelease": false,
  "release": {
    "tag": "axon-slave-v0.1.10",
    "url": "https://github.com/ai-gens/packages/releases/tag/axon-slave-v0.1.10"
  },
  "changelog": {
    "format": "markdown",
    "content": "## Fixes\n\n- Use kernel TCP sockets for Fake TCP paths intercepted by stream proxies.\n  Core routes native AXF1 and exact legacy datagram SYNs to the hidden carrier,\n  while proxy connections use an AXF1 listener on the same public port.\n- Preserve one WireGuard engine and authenticated adjacency per peer across\n  native and kernel carrier paths. Socket identity never authorizes a node.\n- Apply backpressure before compatibility output queues fill, run socket pumps\n  independently, bound blocked writes, and abort all pumps during shutdown.\n- Preserve TCP compatibility failure diagnostics and include control connection\n  error chains and reconnect delays in Slave host logs.\n- Verify sustained, concurrent transfers on the NAS, Hong Kong, and Beijing\n  hosts; native Fake TCP remains in use for direct public Hub connections.\n\n## Compatibility\n\n- Upgrade every Core before testing Fake TCP through a TCP middlebox. Keep the\n  fleet on native UDP or UoT during its signed update."
  },
  "assets": [
    {
      "name": "axon-slave-v0.1.10-linux-amd64.zip",
      "os": "linux",
      "arch": "amd64",
      "target": "x86_64-unknown-linux-musl",
      "size": 3593300,
      "sha256": "ee922ea7d9424113679665c4f5ab531081de0c19b9d9288f577f5fde9960a7e7",
      "downloadUrl": "https://github.com/ai-gens/packages/releases/download/axon-slave-v0.1.10/axon-slave-v0.1.10-linux-amd64.zip"
    },
    {
      "name": "axon-slave-v0.1.10-linux-arm64.zip",
      "os": "linux",
      "arch": "arm64",
      "target": "aarch64-unknown-linux-musl",
      "size": 3250930,
      "sha256": "fcde85d0644961b0fb4b8546f82031d277ba4cfe8d7ea4935bb350f79b67a7b9",
      "downloadUrl": "https://github.com/ai-gens/packages/releases/download/axon-slave-v0.1.10/axon-slave-v0.1.10-linux-arm64.zip"
    },
    {
      "name": "axon-slave-v0.1.10-macos-amd64.zip",
      "os": "macos",
      "arch": "amd64",
      "target": "x86_64-apple-darwin",
      "size": 3235787,
      "sha256": "55414779ec998b159bdee2ce53117b76c90569748a289694840f82cf101355ff",
      "downloadUrl": "https://github.com/ai-gens/packages/releases/download/axon-slave-v0.1.10/axon-slave-v0.1.10-macos-amd64.zip"
    },
    {
      "name": "axon-slave-v0.1.10-macos-arm64.zip",
      "os": "macos",
      "arch": "arm64",
      "target": "aarch64-apple-darwin",
      "size": 3002153,
      "sha256": "ed4d05d268f8548f3d7d41e53b61d20b811fed43e24a486e76303c1d26ab6514",
      "downloadUrl": "https://github.com/ai-gens/packages/releases/download/axon-slave-v0.1.10/axon-slave-v0.1.10-macos-arm64.zip"
    }
  ]
}
